{
  "$schema": "https://json-schema.org/draft/2020-12/schema",
  "$id": "https://himi.local/schemas/hsk2-workbook-lesson.schema.json",
  "title": "HSK 2 workbook lesson",
  "type": "object",
  "additionalProperties": false,
  "required": [
    "schemaVersion",
    "id",
    "lessonNumber",
    "status",
    "title",
    "source",
    "sections",
    "answerStatus",
    "editorial"
  ],
  "properties": {
    "$schema": {
      "type": "string"
    },
    "schemaVersion": {
      "const": "1.0.0"
    },
    "id": {
      "type": "string",
      "pattern": "^hsk2-wb-lesson-[0-9]{2}$"
    },
    "lessonNumber": {
      "type": "integer",
      "minimum": 1,
      "maximum": 15
    },
    "status": {
      "enum": [
        "draft",
        "review",
        "published"
      ]
    },
    "title": {
      "type": "object",
      "required": [
        "zh",
        "pinyin",
        "vi"
      ],
      "properties": {
        "zh": {
          "type": "string"
        },
        "pinyin": {
          "type": "string"
        },
        "vi": {
          "type": "string"
        }
      },
      "additionalProperties": false
    },
    "source": {
      "type": "object",
      "required": [
        "pdfPages",
        "printedPages",
        "sourcePageRefs"
      ]
    },
    "sections": {
      "type": "array",
      "minItems": 4,
      "maxItems": 4,
      "items": {
        "type": "object",
        "required": [
          "id",
          "type",
          "exerciseGroupRefs"
        ],
        "properties": {
          "id": {
            "type": "string"
          },
          "type": {
            "enum": [
              "listening",
              "reading",
              "pronunciation",
              "hanzi"
            ]
          },
          "exerciseGroupRefs": {
            "type": "array",
            "minItems": 1,
            "items": {
              "type": "string"
            }
          }
        },
        "additionalProperties": false
      }
    },
    "answerStatus": {
      "const": "not-provided-in-source-pdf"
    },
    "editorial": {
      "type": "object"
    }
  }
}
