{
  "$schema": "../schemas/workbook-lesson.schema.json",
  "schemaVersion": "1.0.0",
  "id": "hsk2-wb-lesson-14",
  "lessonNumber": 14,
  "status": "review",
  "title": {
    "zh": "你看过这个电影吗？",
    "pinyin": "nǐ kàn guò zhè ge diàn yǐng ma ？",
    "vi": "Cậu đã từng xem phim đó chưa?"
  },
  "source": {
    "pdfPages": [
      130,
      138
    ],
    "printedPages": [
      130,
      138
    ],
    "sourcePageRefs": [
      "hsk2-wb-source-page-130",
      "hsk2-wb-source-page-131",
      "hsk2-wb-source-page-132",
      "hsk2-wb-source-page-133",
      "hsk2-wb-source-page-134",
      "hsk2-wb-source-page-135",
      "hsk2-wb-source-page-136",
      "hsk2-wb-source-page-137",
      "hsk2-wb-source-page-138"
    ]
  },
  "sections": [
    {
      "id": "hsk2-wb-lesson-14-listening",
      "type": "listening",
      "exerciseGroupRefs": [
        "hsk2-wb-lesson-14-listening-part-1",
        "hsk2-wb-lesson-14-listening-part-2",
        "hsk2-wb-lesson-14-listening-part-3"
      ]
    },
    {
      "id": "hsk2-wb-lesson-14-reading",
      "type": "reading",
      "exerciseGroupRefs": [
        "hsk2-wb-lesson-14-reading-part-1",
        "hsk2-wb-lesson-14-reading-part-2",
        "hsk2-wb-lesson-14-reading-part-3",
        "hsk2-wb-lesson-14-reading-part-4"
      ]
    },
    {
      "id": "hsk2-wb-lesson-14-pronunciation-section",
      "type": "pronunciation",
      "exerciseGroupRefs": [
        "hsk2-wb-lesson-14-pronunciation"
      ]
    },
    {
      "id": "hsk2-wb-lesson-14-hanzi-section",
      "type": "hanzi",
      "exerciseGroupRefs": [
        "hsk2-wb-lesson-14-hanzi"
      ]
    }
  ],
  "answerStatus": "not-provided-in-source-pdf",
  "editorial": {
    "publicationReady": false,
    "requiredActions": [
      "Đối chiếu các dòng OCR với trang PDF.",
      "Bổ sung tệp audio theo mã track.",
      "Bổ sung đáp án từ nguồn được cấp phép.",
      "Trích xuất hoặc thay thế hình minh họa bằng asset có quyền sử dụng."
    ]
  }
}
